Research, A gere Systems, Lucent Technologies, Microelectronics Division	Bell Labs, 600 Mountain Ave, Murray Hill, NJ	false
Dept. of Sci. & Inf. Technol., Univ. Inst. of Lisbon, Lisbon, Portugal|c|	Dept. of Sci. & Inf. Technol., UI-Lisbon, Lisbon, Portugal|c|	true
School of Electrical Engineering, KTH—Royal Institute of Technology, Stockholm, Sweden	Access Linnaeus Center, School of Electrical Engineering, KTH Royal Institute of Technology, Stockholm, Sweden|c|	true
Univ Bristol, Dept Elect & Elect Engn, Commun Syst & Networks Grp, Bristol, Avon, England	Univ Bristol, Commun Syst & Networks, Merchants Ventures Bldg,Woodland Rd, Bristol BS8 1TJ, Avon, England	true
Fac. of Eng., Bar-Ilan Univ., Ramat-Gan, Israel|c|	Fac. of Eng., Bar-Ilan Univ., Ramat Gan, Israel|c|	true
university of agder	linnaeus university	false
Department of Automatic Control, Lund Institute of Technology, Lund, Sweden	Department of Automatic Control, Lund Institute of Technology, Box 725, S-220 07 Lund 7, Sweden	true
Sobolev Institute of Mathematics, Siberian Branch of the Russian Academy of Sciences, Novosibirsk, Russia	Sobolev Inst Math, Pr Ac Koptyuga 4, Novosibirsk 630090, Russia	false
Business School, Nanfang College. Guangzhou, Guangzhou, China	Business School, Nanfang College. Guangzhou, Guangzhou, China	true
